{
  "$schema": "../../schemas/graph.schema.json",
  "version": "0.1.0",
  "seed": "speckit-seed-0001",
  "company": { "funds": 100000 },
  "structures": [
    {
      "id": "str-1",
      "name": "Site A",
      "lat": 52.52,
      "lon": 13.4,
      "budgets": {
        "maxArea_m2": 200,
        "gridCapacity_kW": 150,
        "waterMain_Lph": 1000,
        "exhaust_m3ph": 5000
      },
      "laborPoolMinutesPerHour": 240,
      "laborWeights": { "ops": 0.6, "maint": 0.3, "log": 0.1 }
    }
  ],
  "rooms": [
    {
      "id": "room-veg",
      "structureId": "str-1",
      "hasZones": true,
      "purpose": "Veg",
      "budgets": {
        "roomArea_m2": 40,
        "roomGrid_kW": 50,
        "roomWater_Lph": 300,
        "roomExhaust_m3ph": 1200
      }
    }
  ],
  "zones": [
    {
      "id": "zone-a",
      "roomId": "room-veg",
      "zoneArea_m2": 20,
      "nodes": [],
      "edges": []
    }
  ]
}

